{
  "schema_version": "auneya-claim-v0.1",
  "claim_id": "auneya_claim_download_integrity_001",
  "claim_type": "download_integrity",
  "title": "Public download integrity can be checked",
  "asserted_statement": "A public download can be checked by comparing its observed content hash against an expected hash.",
  "target": {
    "kind": "download_url",
    "locator": "https://example.com/file.tar.gz",
    "expected_hash": "sha256:0000000000000000000000000000000000000000000000000000000000000000"
  },
  "public_access": {
    "access_type": "public_web",
    "lawful_basis": "publicly_accessible",
    "requires_authentication": false,
    "requires_payment": false,
    "contains_personal_data": false
  },
  "evidence_requirements": [
    "http_status",
    "content_hash"
  ],
  "expiry_policy": {
    "mode": "time_window",
    "max_age_seconds": 86400,
    "recheck_trigger": "download contents may be replaced"
  },
  "legal_boundary": {
    "private_data_prohibited": true,
    "hacked_data_prohibited": true,
    "paywall_bypass_prohibited": true,
    "credential_use_prohibited": true,
    "surveillance_prohibited": true,
    "notes": "Only public download metadata and content hash may be checked."
  },
  "status": "draft",
  "created_at": "2026-10-06T00:00:00Z",
  "non_value_notice": "This claim is protocol research and does not create a token, reward or market value."
}
