{
  "schema_version": "auneya-claim-v0.1",
  "claim_id": "auneya_claim_release_reality_001",
  "claim_type": "release_reality",
  "title": "WVP public release metadata exists",
  "asserted_statement": "The public WVP repository has release metadata that can be checked without private access.",
  "target": {
    "kind": "release",
    "locator": "https://github.com/nightfall-wizard/wizard-verification-protocol/releases",
    "expected_publisher": "nightfall-wizard"
  },
  "public_access": {
    "access_type": "public_repository",
    "lawful_basis": "publicly_accessible",
    "requires_authentication": false,
    "requires_payment": false,
    "contains_personal_data": false
  },
  "evidence_requirements": [
    "http_status",
    "release_metadata",
    "publisher_identity"
  ],
  "expiry_policy": {
    "mode": "time_window",
    "max_age_seconds": 604800,
    "recheck_trigger": "release metadata may change"
  },
  "legal_boundary": {
    "private_data_prohibited": true,
    "hacked_data_prohibited": true,
    "paywall_bypass_prohibited": true,
    "credential_use_prohibited": true,
    "surveillance_prohibited": true,
    "notes": "Only public repository metadata may be checked."
  },
  "status": "draft",
  "created_at": "2026-10-06T00:00:00Z",
  "non_value_notice": "This claim is protocol research and does not create a token, reward or market value."
}
