{
  "schema_version": "auneya-claim-v0.1",
  "claim_id": "auneya_claim_website_reality_001",
  "claim_type": "website_claim_reality",
  "title": "Public webpage claim can be witnessed",
  "asserted_statement": "A public webpage claim can be checked by recording public status and a page snapshot hash.",
  "target": {
    "kind": "web_url",
    "locator": "https://example.com/public-claim"
  },
  "public_access": {
    "access_type": "public_web",
    "lawful_basis": "publicly_accessible",
    "requires_authentication": false,
    "requires_payment": false,
    "contains_personal_data": false
  },
  "evidence_requirements": [
    "http_status",
    "page_snapshot_hash"
  ],
  "expiry_policy": {
    "mode": "time_window",
    "max_age_seconds": 21600,
    "recheck_trigger": "webpage content may change"
  },
  "legal_boundary": {
    "private_data_prohibited": true,
    "hacked_data_prohibited": true,
    "paywall_bypass_prohibited": true,
    "credential_use_prohibited": true,
    "surveillance_prohibited": true,
    "notes": "Only public webpage content may be checked."
  },
  "status": "draft",
  "created_at": "2026-10-06T00:00:00Z",
  "non_value_notice": "This claim is protocol research and does not create a token, reward or market value."
}
